1505.02403v2,2015-05-10T16:18:43Z,Representation of traces by vectors of words,Samy Abbes,cs.DM,http://arxiv.org/pdf/1505.02403v2
1505.04918v2,2015-05-19T09:19:39Z,Sublinear Approximation Algorithms for Boxicity and Related Problems,L. Sunil Chandran,cs.DM,http://arxiv.org/pdf/1505.04918v2
1505.05220v2,2015-05-20T01:50:28Z,The key properties of inconsistency indicators for a triad in pairwise   comparison matrices,J. Szybowski,cs.DM,http://arxiv.org/pdf/1505.05220v2
1505.05423v2,2015-05-20T15:35:49Z,Submodular Function Maximization over Distributive and Integer Lattices,Britta Peis,cs.DM,http://arxiv.org/pdf/1505.05423v2
1505.07780v2,2015-05-28T18:05:28Z,A characterization of b-chromatic and partial Grundy numbers by induced   subgraphs,Olivier Togni,cs.DM,http://arxiv.org/pdf/1505.07780v2
1506.00202v1,2015-05-31T08:28:51Z,A complexity dichotomy for the dominating set problem,D. S. Malyshev,cs.DM,http://arxiv.org/pdf/1506.00202v1
1506.00718v1,2015-06-02T01:14:42Z,Peeling Algorithm on Random Hypergraphs with Superlinear Number of   Hyperedges,Osamu Watanabe,cs.DM,http://arxiv.org/pdf/1506.00718v1
1506.01055v1,2015-05-20T13:03:55Z,An inequality for the Fourier spectrum of parity decision trees,Andrew Wan,cs.DM,http://arxiv.org/pdf/1506.01055v1
1506.01544v1,2015-06-04T11:01:17Z,Carry Value Transformation (CVT) - Exclusive OR (XOR) Tree and Its   Significant Properties,Sudhakar Sahoo,cs.DM,http://arxiv.org/pdf/1506.01544v1
1506.02678v1,2015-06-08T20:10:55Z,Topology-preserving digitization of n-dimensional objects by   constructing cubical models,Alexander V. Evako,cs.DM,http://arxiv.org/pdf/1506.02678v1
1506.03613v1,2015-06-11T10:26:10Z,Simultaneously Moving Cops and Robbers,Athanasios Kehagias,cs.DM,http://arxiv.org/pdf/1506.03613v1
1506.05018v1,2015-06-16T16:13:43Z,Revisiting Pattern Structure Projections,Amedeo Napoli,cs.DM,http://arxiv.org/pdf/1506.05018v1
1506.05279v2,2015-06-17T11:21:35Z,Non-dominating sequences of vectors using only resets and increments,Eryk Kopczynski,cs.DM,http://arxiv.org/pdf/1506.05279v2
1506.07248v1,2015-06-24T06:03:18Z,Packing coloring of some undirected and oriented coronae graphs,Eric Sopena,cs.DM,http://arxiv.org/pdf/1506.07248v1
1506.07338v1,2015-06-24T12:19:45Z,Orienting edges to fight fire in graphs,Nick Brettell,cs.DM,http://arxiv.org/pdf/1506.07338v1
1506.07731v1,2015-06-25T12:55:22Z,A multidimensional maximum bisection problem,Zoran Maksimovic,cs.DM,http://arxiv.org/pdf/1506.07731v1
1506.08592v2,2015-06-29T11:49:29Z,Adding Isolated Vertices Makes some Online Algorithms Optimal,Christian Kudahl,cs.DM,http://arxiv.org/pdf/1506.08592v2
1506.08658v2,2015-06-29T14:49:19Z,Lattice decompositions through methods using congruence relations,Rokia Missaoui,cs.DM,http://arxiv.org/pdf/1506.08658v2
1508.00068v1,2015-08-01T01:56:14Z,A New Property of Hamilton Graphs,Heping Jiang,cs.DM,http://arxiv.org/pdf/1508.00068v1
1508.00614v1,2015-08-03T23:14:22Z,Popular Edges and Dominant Matchings,Telikepalli Kavitha,cs.DM,http://arxiv.org/pdf/1508.00614v1
1508.01014v1,2015-08-05T09:27:49Z,Computational complexity of distance edge labeling,Tomáš Masařík,cs.DM,http://arxiv.org/pdf/1508.01014v1
1508.01441v2,2015-08-06T15:52:47Z,Equivalence of the filament and overlap graphs of subtrees of limited   trees,Lorna Stewart,cs.DM,http://arxiv.org/pdf/1508.01441v2
1508.02497v2,2015-08-11T07:18:14Z,Minority population in the one-dimensional Schelling model of   segregation,Andy Lewis-Pye,cs.DM,http://arxiv.org/pdf/1508.02497v2
1508.03062v1,2015-08-12T20:38:01Z,"On the structure of (pan, even hole)-free graphs",Chinh T. Hoang,cs.DM,http://arxiv.org/pdf/1508.03062v1
1508.03458v1,2015-08-14T10:15:53Z,Total Variation Discrepancy of Deterministic Random Walks for Ergodic   Markov Chains,Masafumi Yamashita,cs.DM,http://arxiv.org/pdf/1508.03458v1
1508.03800v12,2015-08-16T08:35:13Z,Corona graphs as a model of small-world networks,Zhongzhi Zhang,cs.DM,http://arxiv.org/pdf/1508.03800v12
1508.04725v2,2015-08-19T18:06:12Z,Partitioning graphs into induced subgraphs,Dušan Knop,cs.DM,http://arxiv.org/pdf/1508.04725v2
1508.04741v1,2015-08-19T18:56:33Z,Arrow type impossibility theorems over median algebras,Gerasimos C. Meletiou,cs.DM,http://arxiv.org/pdf/1508.04741v1
1508.06967v1,2015-08-27T18:50:53Z,A Simple Algorithm for Coloring m-Clique Holes,Bechir Hamdaoui,cs.DM,http://arxiv.org/pdf/1508.06967v1
1508.07181v1,2015-08-28T12:32:56Z,Fast Factorization of Cartesian products of Hypergraphs,Florian Lehner,cs.DM,http://arxiv.org/pdf/1508.07181v1
1508.07217v1,2015-08-28T14:09:21Z,On homomorphism of oriented graphs with respect to push operation,Sagnik Sen,cs.DM,http://arxiv.org/pdf/1508.07217v1
1508.07222v1,2015-08-28T14:17:15Z,On chromatic number of colored mixed graphs,Sagnik Sen,cs.DM,http://arxiv.org/pdf/1508.07222v1
1508.07733v2,2015-08-31T09:29:11Z,Weighted Efficient Domination for $P_6$-Free Graphs in Polynomial Time,Raffaele Mosca,cs.DM,http://arxiv.org/pdf/1508.07733v2
1509.01301v1,2015-09-03T22:58:14Z,Completing orientations of partially oriented graphs,Xuding Zhu,cs.DM,http://arxiv.org/pdf/1509.01301v1
1509.01307v1,2015-09-03T23:16:17Z,End-vertices of LBFS of (AT-free) bigraphs,Jing Huang,cs.DM,http://arxiv.org/pdf/1509.01307v1
1509.01576v1,2015-09-04T19:54:42Z,Invertibility modulo dead-ending no-P-universes,Gabriel Renault,cs.DM,http://arxiv.org/pdf/1509.01576v1
1509.01852v2,2015-09-06T20:34:53Z,Weighted paths between partitions,Giovanni Rossi,cs.DM,http://arxiv.org/pdf/1509.01852v2
1509.03574v2,2015-09-11T16:14:36Z,On extremal trees with respect to the $F$-index,Ivan Gutman,cs.DM,http://arxiv.org/pdf/1509.03574v2
1509.04199v2,2015-09-14T16:57:57Z,i-MARK: A New Subtraction Division Game,Eric Sopena,cs.DM,http://arxiv.org/pdf/1509.04199v2
1509.04944v1,2015-09-16T15:13:08Z,Convexities in Some Special Graph Classes ---New Results in AT-free   Graphs and Beyond,Yue-Li Wang,cs.DM,http://arxiv.org/pdf/1509.04944v1
1509.05069v1,2015-09-16T21:38:32Z,On Tree Representations of Relations and Graphs: Symbolic Ultrametrics   and Cograph Edge Decompositions,Nicolas Wieseke,cs.DM,http://arxiv.org/pdf/1509.05069v1
1509.05977v1,2015-09-20T08:11:51Z,Group-theoretical vector space model,Dohan Kim,cs.DM,http://arxiv.org/pdf/1509.05977v1
1509.06191v1,2015-09-21T11:31:01Z,Lower Bounds on Same-Set Inner Product in Correlated Spaces,Elchanan Mossel,cs.DM,http://arxiv.org/pdf/1509.06191v1
1509.06305v2,2015-09-21T17:13:09Z,On a linearization technique for solving quadratic set covering problem   and variations,Abraham P. Punnen,cs.DM,http://arxiv.org/pdf/1509.06305v2
1509.06349v1,2015-09-21T19:16:45Z,A square root map on Sturmian words,Markus Whiteland,cs.DM,http://arxiv.org/pdf/1509.06349v1
1509.06434v1,2015-09-22T00:30:01Z,"Efficient Reassembling of Graphs, Part 1: The Linear Case",Saber Mirzaei,cs.DM,http://arxiv.org/pdf/1509.06434v1
1509.06983v2,2015-09-23T13:54:15Z,Techniques for the Cograph Editing Problem: Module Merge is equivalent   to Editing P4s,Peter F. Stadler,cs.DM,http://arxiv.org/pdf/1509.06983v2
1509.07029v1,2015-09-23T15:24:57Z,The Global Packing Number for an Optical Network,Hung-Lin Fu,cs.DM,http://arxiv.org/pdf/1509.07029v1
1509.07076v1,2015-09-23T17:55:28Z,Graphic Realizations of Joint-Degree Matrices,Milena Mihail,cs.DM,http://arxiv.org/pdf/1509.07076v1
1509.07702v3,2015-09-25T13:00:57Z,Fixed points and connections between positive and negative cycles in   Boolean networks,Adrien Richard,cs.DM,http://arxiv.org/pdf/1509.07702v3
1509.07986v1,2015-09-26T14:23:41Z,Continuous set packing and near-Boolean functions,Giovanni Rossi,cs.DM,http://arxiv.org/pdf/1509.07986v1
1509.08145v1,2015-09-27T21:20:27Z,Linear Arrangement of Halin Graphs,Assaf Kfoury,cs.DM,http://arxiv.org/pdf/1509.08145v1
1509.08456v1,2015-09-26T13:45:08Z,Multilinear objective function-based clustering,Giovanni Rossi,cs.DM,http://arxiv.org/pdf/1509.08456v1
1509.08709v1,2015-09-29T12:12:24Z,Traffic signal optimization: combining static and dynamic models,Martin Strehler,cs.DM,http://arxiv.org/pdf/1509.08709v1
1509.09188v4,2015-09-30T14:20:44Z,A Note on Spectral Clustering,Kurt Mehlhorn,cs.DM,http://arxiv.org/pdf/1509.09188v4
1510.01165v2,2015-10-05T14:22:16Z,Tight lower bounds on the number of bicliques in false-twin-free graphs,Leandro Montero,cs.DM,http://arxiv.org/pdf/1510.01165v2
1510.01276v1,2015-10-01T11:30:07Z,Hadamard Product Decomposition and Mutually Exclusive Matrices on   Network Structure and Utilization,Proceso Fernandez,cs.DM,http://arxiv.org/pdf/1510.01276v1
1510.01520v1,2015-10-06T10:47:27Z,Spectral Properties of Laplacian and Stochastic Diffusion Process for   Edge Expansion in Hypergraphs,Chenzi Zhang,cs.DM,http://arxiv.org/pdf/1510.01520v1
1510.05452v3,2015-10-19T12:58:41Z,On the flora of asynchronous locally non-monotonic Boolean automata   networks,Sylvain Sené,cs.DM,http://arxiv.org/pdf/1510.05452v3
1510.05512v3,2015-10-19T15:04:27Z,Arithmetic for Rooted Trees,Fabrizio Luccio,cs.DM,http://arxiv.org/pdf/1510.05512v3
1510.05524v1,2015-10-19T15:15:18Z,On the Packing Chromatic Number on Hamming Graphs and General Graphs,Pablo Torres,cs.DM,http://arxiv.org/pdf/1510.05524v1
1510.05942v2,2015-10-20T16:09:06Z,Inversion Complexity of Functions of Multi-Valued Logic,Anna V. Mikhailovich,cs.DM,http://arxiv.org/pdf/1510.05942v2
1510.09156v1,2015-10-30T16:58:03Z,A Multiple Search Operator Heuristic for the Max-k-cut Problem,Jin-Kao Hao,cs.DM,http://arxiv.org/pdf/1510.09156v1
1511.00867v2,2015-11-03T12:04:22Z,Dynamic Gossip,François Schwarzentruber,cs.DM,http://arxiv.org/pdf/1511.00867v2
1511.01668v3,2015-11-05T09:33:23Z,Complexity of Steiner Tree in Split Graphs - Dichotomy Results,N. Sadagopan,cs.DM,http://arxiv.org/pdf/1511.01668v3
1511.01696v2,2015-11-05T11:03:49Z,Listing All Spanning Trees in Halin Graphs - Sequential and Parallel   view,N. Sadagopan,cs.DM,http://arxiv.org/pdf/1511.01696v2
1511.01806v1,2015-11-05T16:43:03Z,Flood-it on AT-Free Graphs,Hung-Lung Wang,cs.DM,http://arxiv.org/pdf/1511.01806v1
1511.05109v1,2015-11-16T20:08:24Z,Minimum Eccentricity Shortest Paths in some Structured Graph Classes,Arne Leitert,cs.DM,http://arxiv.org/pdf/1511.05109v1
1511.05422v1,2015-11-17T14:50:08Z,Edge-b-coloring Trees,Ana Silva,cs.DM,http://arxiv.org/pdf/1511.05422v1
1511.06568v3,2015-11-20T12:03:20Z,Matchings of quadratic size extend to long cycles in hypercubes,Tomáš Dvořák,cs.DM,http://arxiv.org/pdf/1511.06568v3
1511.08066v3,2015-11-25T14:08:30Z,"Maximum Weight Independent Sets for ($P_7$,Triangle)-Free Graphs in   Polynomial Time",Raffaele Mosca,cs.DM,http://arxiv.org/pdf/1511.08066v3
1511.09289v2,2015-11-30T13:08:29Z,"Combinatorial Constructions of Optimal $(m, n,4,2)$ Optical Orthogonal   Signature Pattern Codes",Lijun Ji,cs.DM,http://arxiv.org/pdf/1511.09289v2
1512.00184v1,2015-12-01T09:17:10Z,On the diameter of hyperbolic random graphs,Anton Krohmer,cs.DM,http://arxiv.org/pdf/1512.00184v1
1512.00614v1,2015-12-02T08:55:22Z,A connected multidimensional maximum bisection problem,Zoran Maksimovic,cs.DM,http://arxiv.org/pdf/1512.00614v1
1512.02443v1,2015-12-08T12:59:12Z,Even and Odd Cycles Passing a Given Edge or a Vertex,Mehrdad Ghadiri,cs.DM,http://arxiv.org/pdf/1512.02443v1
1512.03139v4,2015-12-10T05:23:25Z,Reduction of the graph isomorphism problem to equality checking of   $n$-variables polynomials and the algorithms that use the reduction,Alexander Prolubnikov,cs.DM,http://arxiv.org/pdf/1512.03139v4
1512.03631v4,2015-12-11T13:19:16Z,"How to find the least upper bound on the van der Waerden Number $W(r,   k)$ that is some integer Power of the coloring Integer $r$",Robert J Betts,cs.DM,http://arxiv.org/pdf/1512.03631v4
1512.05693v2,2015-12-17T17:45:00Z,Co-Clustering Under the Maximum Norm,Rolf Niedermeier,cs.DM,http://arxiv.org/pdf/1512.05693v2
1512.06893v1,2015-12-21T22:24:12Z,The Maximum Cardinality Cut Problem is Polynomial in Proper Interval   Graphs,Mordechai Shalom,cs.DM,http://arxiv.org/pdf/1512.06893v1
1512.07505v1,2015-12-23T15:04:57Z,A short proof of the first selection lemma and weak $\frac{1}{r}$-nets   for moving points,Shakhar Smorodinsky,cs.DM,http://arxiv.org/pdf/1512.07505v1
1512.07613v2,2015-12-23T20:12:14Z,A new topological entropy-based approach for measuring similarities   among piecewise linear functions,Emanuela Merelli,cs.DM,http://arxiv.org/pdf/1512.07613v2
1512.07901v2,2015-12-24T20:42:10Z,Simple set cardinality estimation through random sampling,Luca Pretto,cs.DM,http://arxiv.org/pdf/1512.07901v2
1512.08041v1,2015-12-25T21:48:05Z,Improved Algorithms for Exact and Approximate Boolean Matrix   Decomposition,Tsunehiko Kameda,cs.DM,http://arxiv.org/pdf/1512.08041v1
1512.08070v2,2015-12-26T04:12:11Z,Toward a 6/5 Bound for the Minimum Cost 2-Edge Connected Spanning   Subgraph Problem,Philippe Legault,cs.DM,http://arxiv.org/pdf/1512.08070v2
1512.08757v1,2015-12-29T19:16:41Z,General Cut-Generating Procedures for the Stable Set Polytope,Javier Marenco,cs.DM,http://arxiv.org/pdf/1512.08757v1
1601.00252v1,2016-01-03T07:06:23Z,Greedy online colouring with buffering,Anna Łyczkowska-Hanćkowiak,cs.DM,http://arxiv.org/pdf/1601.00252v1
1601.02371v1,2016-01-11T09:40:02Z,Energy-efficient Routing of Hybrid Vehicles,Martin Strehler,cs.DM,http://arxiv.org/pdf/1601.02371v1
1601.04469v1,2016-01-18T11:10:01Z,Adjacencies in Permutations,Krishnaveni K S,cs.DM,http://arxiv.org/pdf/1601.04469v1
1601.05978v1,2016-01-22T12:45:54Z,On the decomposition of Generalized Additive Independence models,Christophe Labreuche,cs.DM,http://arxiv.org/pdf/1601.05978v1
1602.04061v1,2016-02-12T14:16:36Z,Row-constrained effective sets of colourings in the $2$-fold horocyclic   tessellations of $\mathbb{H}^2$ are sofic,Mathieu Sablik,cs.DM,http://arxiv.org/pdf/1602.04061v1
1602.05032v3,2016-02-16T14:35:03Z,Enumerating all the Irreducible Polynomials over Finite Field,Robert J. Shahla,cs.DM,http://arxiv.org/pdf/1602.05032v3
1602.05838v1,2016-02-18T15:25:55Z,Maximum Weight Independent Set in lClaw-Free Graphs in Polynomial Time,Raffaele Mosca,cs.DM,http://arxiv.org/pdf/1602.05838v1
1602.05909v2,2016-02-18T18:55:16Z,On the Complexity of Weighted Greedy Matchings,Paul G. Spirakis,cs.DM,http://arxiv.org/pdf/1602.05909v2
1602.06910v1,2016-02-19T16:34:39Z,Prime Factoring and The Complexity Of,Charles Sauerbier,cs.DM,http://arxiv.org/pdf/1602.06910v1
1602.07267v1,2016-02-23T19:13:00Z,Towards a closure operator for enumeration of maximal tricliques in   tripartite hypergraphs,Dmitry I. Ignatov,cs.DM,http://arxiv.org/pdf/1602.07267v1
1602.07729v2,2016-02-24T22:15:58Z,The Cover Time of Deterministic Random Walks for General Transition   Probabilities,Takeharu Shiraga,cs.DM,http://arxiv.org/pdf/1602.07729v2
1602.08022v1,2016-02-25T18:16:01Z,Recognizing Optimal 1-Planar Graphs in Linear Time,Franz J. Brandenburg,cs.DM,http://arxiv.org/pdf/1602.08022v1
1602.08653v2,2016-02-28T01:04:33Z,Dijkstra Graphs,Jayme L. Szwarcfiter,cs.DM,http://arxiv.org/pdf/1602.08653v2
1602.09111v1,2016-02-29T19:32:14Z,2-Distance Colorings of Integer Distance Graphs,Isma Bouchemakh,cs.DM,http://arxiv.org/pdf/1602.09111v1
1602.09124v1,2016-02-29T20:24:04Z,Independent Domination versus Weighted Independent Domination,Viktor Zamaraev,cs.DM,http://arxiv.org/pdf/1602.09124v1
1602.09127v1,2016-02-29T20:28:24Z,Stable Equimatchable Graphs,Tınaz Ekim,cs.DM,http://arxiv.org/pdf/1602.09127v1
1603.00898v2,2016-03-02T21:31:54Z,Large Peg-Army Maneuvers,Roberto Tauraso,cs.DM,http://arxiv.org/pdf/1603.00898v2
1603.01179v1,2016-03-03T17:06:14Z,Read networks and k-laminar graphs,Chloe Vigliotti,cs.DM,http://arxiv.org/pdf/1603.01179v1
1603.01807v1,2016-03-06T09:41:17Z,On the Number of Cycles in a Graph,Bader F. AlBdaiwi,cs.DM,http://arxiv.org/pdf/1603.01807v1
1603.01983v2,2016-03-07T09:43:03Z,Graph Theoretic Investigations on Inefficiencies in Network Models,Ivano Salvo,cs.DM,http://arxiv.org/pdf/1603.01983v2
1603.02467v1,2016-03-08T10:33:24Z,"The Mathematics of Xenology: Di-cographs, Symbolic Ultrametrics,   2-structures and Tree-representable Systems of Binary Relations",Nicolas Wieseke,cs.DM,http://arxiv.org/pdf/1603.02467v1
1603.04632v1,2016-03-15T10:54:10Z,Beyond representing orthology relations by trees,G. E. Scholz,cs.DM,http://arxiv.org/pdf/1603.04632v1
1603.04788v1,2016-03-15T18:01:13Z,Correspondences between partitions,Henning Meyerhenke,cs.DM,http://arxiv.org/pdf/1603.04788v1
1603.04917v1,2016-03-15T23:01:03Z,Splines and Wavelets on Circulant Graphs,Pier Luigi Dragotti,cs.DM,http://arxiv.org/pdf/1603.04917v1
1603.07168v1,2016-03-23T13:14:17Z,Popular matchings with two-sided preferences and one-sided ties,Telikepalli Kavitha,cs.DM,http://arxiv.org/pdf/1603.07168v1
1603.08827v1,2016-03-29T16:16:35Z,Generalized Gray codes with prescribed ends,Václav Koubek,cs.DM,http://arxiv.org/pdf/1603.08827v1
1603.09561v1,2016-03-31T12:48:32Z,On a special class of boxicity 2 graphs,Sagnik Sen,cs.DM,http://arxiv.org/pdf/1603.09561v1
1604.04855v1,2016-04-17T09:42:38Z,Fault tolerant supergraphs with automorphisms,Ashwin Ganesan,cs.DM,http://arxiv.org/pdf/1604.04855v1
1604.04978v2,2016-04-18T03:52:20Z,Routing and Sorting Via Matchings On Graphs,Dana Richards,cs.DM,http://arxiv.org/pdf/1604.04978v2
1604.06302v2,2016-04-21T13:40:49Z,A Parameterized Algorithmics Framework for Degree Sequence Completion   Problems in Directed Graphs,Rolf Niedermeier,cs.DM,http://arxiv.org/pdf/1604.06302v2
1604.06884v3,2016-04-23T09:41:05Z,Discordant voting processes on finite graphs,Nicolas Rivera,cs.DM,http://arxiv.org/pdf/1604.06884v3
1604.07036v3,2016-04-24T14:36:07Z,"A Radix Representation for each van der Waerden number $W(r, k)$ with   $r$ colors: Why $\log_{r}W(r, k) < k^{2}$ is true whenever $k$ is the number   of terms in the arithmetic progression",Robert J Betts,cs.DM,http://arxiv.org/pdf/1604.07036v3
1605.00406v1,2016-05-02T09:37:00Z,A Tight Lower Bound for the Weights of Maximum Weight Matching in   Bipartite Graphs,Kalpesh Kapoor,cs.DM,http://arxiv.org/pdf/1605.00406v1
1605.00442v1,2016-05-02T11:42:54Z,Token Sliding on Chordal Graphs,Nicolas Bousquet,cs.DM,http://arxiv.org/pdf/1605.00442v1
1605.00863v1,2016-05-03T12:21:07Z,On the Mathematics of Data Centre Network Topologies,Iain A. Stewart,cs.DM,http://arxiv.org/pdf/1605.00863v1
1605.01319v1,2016-05-04T15:35:00Z,(2/2/3)-SAT problem and its applications in dominating set problems,Ali Dehghan,cs.DM,http://arxiv.org/pdf/1605.01319v1
1605.01483v1,2016-05-05T03:32:27Z,Spectral Properties of Hypergraph Laplacian and Approximation Algorithms,Chenzi Zhang,cs.DM,http://arxiv.org/pdf/1605.01483v1
1605.01505v1,2016-05-05T06:53:22Z,A combinatorial problem about binary necklaces and attractors of Boolean   automata networks,Mathilde Noual,cs.DM,http://arxiv.org/pdf/1605.01505v1
1605.02891v1,2016-05-10T08:41:16Z,Path-Additions of Graphs,Daniel Neuwirth,cs.DM,http://arxiv.org/pdf/1605.02891v1
1605.02905v1,2016-05-10T09:39:56Z,Analysis of Algorithms for Permutations Biased by Their Number of   Records,Carine Pivoteau,cs.DM,http://arxiv.org/pdf/1605.02905v1
1605.04609v2,2016-05-15T21:51:47Z,The Stable Roommates problem with short lists,David F. Manlove,cs.DM,http://arxiv.org/pdf/1605.04609v2
1605.05542v1,2016-05-18T12:11:17Z,A note on the shortest common superstring of NGS reads,Raluca Uricaru,cs.DM,http://arxiv.org/pdf/1605.05542v1
1605.05777v2,2016-05-18T22:22:59Z,Axioms of the Analytic Hierarchy Process (AHP) and its Generalization to   Dependence and Feedback: The Analytic Network Process (ANP),Konrad Kułakowski,cs.DM,http://arxiv.org/pdf/1605.05777v2
1605.05924v2,2016-05-19T12:51:37Z,Exploiting Equitable Partitions for Efficient Block Triangularization,Mario Thüne,cs.DM,http://arxiv.org/pdf/1605.05924v2
1605.06989v1,2016-05-23T12:16:02Z,Experimental Evaluation of Modified Decomposition Algorithm for Maximum   Weight Bipartite Matching,Rahul Kadyan,cs.DM,http://arxiv.org/pdf/1605.06989v1
1605.07322v1,2016-05-24T07:26:39Z,A Simpler Recognition Algorithm for Simple-Triangle Graphs,Asahi Takaoka,cs.DM,http://arxiv.org/pdf/1605.07322v1
1605.07411v1,2016-05-24T12:28:54Z,$χ$-bounded families of oriented graphs,Jose Zamora,cs.DM,http://arxiv.org/pdf/1605.07411v1
1605.08066v1,2016-05-24T19:01:54Z,"A generalization of unit distances, angular properties and convexity",Abhijeet Khopkar,cs.DM,http://arxiv.org/pdf/1605.08066v1
1605.08366v3,2016-05-26T17:05:13Z,"Hitting minors, subdivisions, and immersions in tournaments",Jean-Florent Raymond,cs.DM,http://arxiv.org/pdf/1605.08366v3
1605.08403v1,2016-05-26T18:44:24Z,Fast plurality consensus in regular expanders,Takeharu Shiraga,cs.DM,http://arxiv.org/pdf/1605.08403v1
1605.08870v1,2016-05-28T10:08:32Z,k-neighborhood for Cellular Automata,Dmitry A. Zaitsev,cs.DM,http://arxiv.org/pdf/1605.08870v1
1606.00359v1,2016-06-01T17:15:14Z,On strictly Chordality-k graphs,N. Sadagopan,cs.DM,http://arxiv.org/pdf/1606.00359v1
1606.00974v1,2016-06-03T06:05:44Z,A Graph Theoretical Analysis of Low-Power Coding Schemes for One-Hop   Networks,Akiko Manada,cs.DM,http://arxiv.org/pdf/1606.00974v1
1606.02340v1,2016-06-07T21:46:57Z,Some Algorithmic Results on Restrained Domination in Graphs,B. S. Panda,cs.DM,http://arxiv.org/pdf/1606.02340v1
1606.05989v1,2016-06-20T07:02:13Z,F-index of Total Transformation Graphs,Nilanjan De,cs.DM,http://arxiv.org/pdf/1606.05989v1
1606.06865v2,2016-06-22T09:33:52Z,On Asymptotics of Moment Distance Between Sensors and Anchor Points,Rafał Kapelko,cs.DM,http://arxiv.org/pdf/1606.06865v2
1606.07709v2,2016-06-24T14:44:10Z,The Niceness of Unique Sink Orientations,Antonis Thomas,cs.DM,http://arxiv.org/pdf/1606.07709v2
1606.08085v1,2016-06-26T20:56:06Z,Sampling and Reconstruction of Sparse Signals on Circulant Graphs - An   Introduction to Graph-FRI,Pier Luigi Dragotti,cs.DM,http://arxiv.org/pdf/1606.08085v1
1606.09368v1,2016-06-30T07:06:29Z,Probabilistic Construction and Analysis of Seminormalized Hadamard   Matrices,Andriyan B. Suksmono,cs.DM,http://arxiv.org/pdf/1606.09368v1
1606.09488v2,2016-06-30T13:50:51Z,A weakly universal cellular automaton in the heptagrid,Maurice Margenstern,cs.DM,http://arxiv.org/pdf/1606.09488v2
1607.00106v1,2016-07-01T04:02:55Z,A note on extended Euclid's algorithm,Hing Leung,cs.DM,http://arxiv.org/pdf/1607.00106v1
1607.01283v1,2016-07-05T14:53:54Z,Identity of King and Flajolet & al. Formulae for LRU Miss Rate Exact   Computation,Christian Berthet,cs.DM,http://arxiv.org/pdf/1607.01283v1
1607.02637v1,2016-07-09T17:25:37Z,Network Flows Under Thermal Restrictions,Shrisha Rao,cs.DM,http://arxiv.org/pdf/1607.02637v1
1607.03848v2,2016-07-13T18:14:32Z,Periodicity of identifying codes in strips,Minghui Jiang,cs.DM,http://arxiv.org/pdf/1607.03848v2
1607.05817v1,2016-07-20T04:22:37Z,Spanning Trees in 2-trees,Douglas B. West,cs.DM,http://arxiv.org/pdf/1607.05817v1
1607.06021v1,2016-07-20T16:50:41Z,Shared multi-processor scheduling,Wieslaw Kubiak,cs.DM,http://arxiv.org/pdf/1607.06021v1
1607.06911v1,2016-07-23T10:09:56Z,Fixing improper colorings of graphs,Paweł Rzążewski,cs.DM,http://arxiv.org/pdf/1607.06911v1
1607.07082v1,2016-07-24T19:20:05Z,On the edge capacitated Steiner tree problem,Alain Hertz,cs.DM,http://arxiv.org/pdf/1607.07082v1
1608.01542v2,2016-08-04T14:26:32Z,Lower Bounds on the mim-width of Some Graph Classes,Stefan Mengel,cs.DM,http://arxiv.org/pdf/1608.01542v2
1608.01568v1,2016-08-04T15:02:01Z,Derandomizing Chernoff Bound with Union Bound with an Application to   $k$-wise Independent Sets,Nader H. Bshouty,cs.DM,http://arxiv.org/pdf/1608.01568v1
1608.03943v1,2016-08-13T05:22:02Z,Capturing Lombardi Flow in Orthogonal Drawings by Minimizing the Number   of Segments,Michael T. Goodrich,cs.DM,http://arxiv.org/pdf/1608.03943v1
1608.04217v1,2016-08-15T09:32:12Z,An iterated local search algorithm for the minimum differential   dispersion problem,Jin-Kao Hao,cs.DM,http://arxiv.org/pdf/1608.04217v1
1608.04319v1,2016-08-15T16:28:14Z,Narumi-Katayama Index of Total Transformation Graphs,Nilanjan De,cs.DM,http://arxiv.org/pdf/1608.04319v1
1608.04866v1,2016-08-17T06:20:15Z,On the Distinguishing Number of Cyclic Tournaments: Towards   Albertson-Collins Conjecture,Eric Sopena,cs.DM,http://arxiv.org/pdf/1608.04866v1
1608.04883v1,2016-08-17T07:48:07Z,Approximating the Chromatic Polynomial,Isabel Beichl,cs.DM,http://arxiv.org/pdf/1608.04883v1
1608.05169v1,2016-08-18T04:31:00Z,P_3-Games,Tao-Ming Wang,cs.DM,http://arxiv.org/pdf/1608.05169v1
1608.05235v1,2016-08-18T10:45:59Z,On the Irregularity of Some Molecular Structures,Wei Gao,cs.DM,http://arxiv.org/pdf/1608.05235v1
1608.05479v1,2016-08-19T02:40:03Z,Efficient Computation of Slepian Functions on the Sphere,Rodney A. Kennedy,cs.DM,http://arxiv.org/pdf/1608.05479v1
1608.05637v2,2016-08-19T15:23:31Z,Polynomial Kernels and Wideness Properties of Nowhere Dense Graph   Classes,Sebastian Siebertz,cs.DM,http://arxiv.org/pdf/1608.05637v2
1608.06520v1,2016-08-23T14:26:13Z,Robust Flows over Time: Models and Complexity Results,Andreas Wierz,cs.DM,http://arxiv.org/pdf/1608.06520v1
1608.06797v1,2016-08-24T12:50:52Z,Additive Stabilizers for Unstable Graphs,Andreas Wierz,cs.DM,http://arxiv.org/pdf/1608.06797v1
1608.07038v2,2016-08-25T07:33:37Z,The (minimum) rank of typical fooling set matrices,Dirk Oliver Theis,cs.DM,http://arxiv.org/pdf/1608.07038v2
1608.07634v1,2016-08-27T00:10:10Z,Performance Guaranteed Approximation Algorithm for Minimum $k$-Connected   $m$-Fold Dominating Set,Ding-Zhu Du,cs.DM,http://arxiv.org/pdf/1608.07634v1
1608.08740v1,2016-08-31T06:34:20Z,1700 Forests,Nachum Dershowitz,cs.DM,http://arxiv.org/pdf/1608.08740v1
1609.01116v1,2016-09-05T11:58:43Z,Modelling simultaneous broadcasting by level-disjoint partitions,Vida Vukasinovic,cs.DM,http://arxiv.org/pdf/1609.01116v1
1609.01266v1,2016-09-05T19:44:02Z,Integrality of minimal unit circular-arc models,Pablo Terlisky,cs.DM,http://arxiv.org/pdf/1609.01266v1
1609.01510v1,2016-09-06T12:01:56Z,Upper Domination: towards a dichotomy through boundary properties,Viktor Zamaraev,cs.DM,http://arxiv.org/pdf/1609.01510v1
