cs/9811026v2,1998-11-16T19:42:30Z,Designing an interface to optimize reading with small display windows,Paul Muter,cs.HC,http://arxiv.org/pdf/cs/9811026v2
cs/9812023v1,1998-12-29T16:50:27Z,Virtual Kathakali : Gesture Driven Metamorphosis,Amitabha Mukerjee,cs.HC,http://arxiv.org/pdf/cs/9812023v1
cs/9903019v2,1999-03-30T21:28:07Z,Workflow Automation with Lotus Notes for the Governmental Administrative   Information System,Saulius Maskeliunas,cs.HC,http://arxiv.org/pdf/cs/9903019v2
cs/0101029v1,2001-01-26T07:27:02Z,Tap Tips: Lightweight Discovery of Touchscreen Targets,Allison Woodruff,cs.HC,http://arxiv.org/pdf/cs/0101029v1
cs/0101035v2,2001-01-28T07:14:46Z,"The Guidebook, the Friend, and the Room: Visitor Experience in a   Historic House",Margaret H. Szymanski,cs.HC,http://arxiv.org/pdf/cs/0101035v2
cs/0110006v1,2001-10-02T12:08:41Z,"Electronic Commerce, Consumer Search and Retailing Cost Reduction",Cristina Mazón,cs.HC,http://arxiv.org/pdf/cs/0110006v1
cs/0111024v1,2001-11-09T01:02:00Z,Building Multi-Platform User Interfaces with UIML,Marc Abrams,cs.HC,http://arxiv.org/pdf/cs/0111024v1
cs/0111025v1,2001-11-09T01:10:00Z,A Multi-Step Process for Generating Multi-Platform User Interfaces using   UIML,Marc Abrams,cs.HC,http://arxiv.org/pdf/cs/0111025v1
cs/0205054v1,2002-05-21T03:07:01Z,Eavesdropping on Electronic Guidebooks: Observing Learning Resources in   Shared Listening Environments,James D. Thornton,cs.HC,http://arxiv.org/pdf/cs/0205054v1
cs/0205055v1,2002-05-21T03:16:49Z,Practical Strategies for Integrating a Conversation Analyst in an   Iterative Design Process,Paul M. Aoki,cs.HC,http://arxiv.org/pdf/cs/0205055v1
cs/0210014v1,2002-10-16T07:42:30Z,Current state of the Sonix -- the IBR-2 instrument control software and   plans for future developments,A. S. Kirilov,cs.HC,http://arxiv.org/pdf/cs/0210014v1
cs/0211037v1,2002-11-26T15:41:59Z,Annotations for HTML to VoiceXML Transcoding: Producing Voice WebPages   with Usability in Mind,Manuel A. Perez-Quinones,cs.HC,http://arxiv.org/pdf/cs/0211037v1
cs/0304001v1,2003-03-31T22:49:29Z,Design Guidelines for Landmarks to Support Navigation in Virtual   Environments,Norman G. Vinson,cs.HC,http://arxiv.org/pdf/cs/0304001v1
cs/0305003v1,2003-05-05T11:32:59Z,The Ubiquitous Interactor - Device Independent Access to Mobile Services,Annika Waern,cs.HC,http://arxiv.org/pdf/cs/0305003v1
cs/0309001v2,2003-08-31T20:13:10Z,Media Affordances of a Mobile Push-To-Talk Communication Service,Paul M. Aoki,cs.HC,http://arxiv.org/pdf/cs/0309001v2
cs/0311006v1,2003-11-07T02:17:34Z,How Push-To-Talk Makes Talk Less Pushy,Paul M. Aoki,cs.HC,http://arxiv.org/pdf/cs/0311006v1
cs/0312017v1,2003-12-09T03:44:07Z,An Exploratory Study of Mobile Computing Use by Knowledge Workers,Paul Prekop,cs.HC,http://arxiv.org/pdf/cs/0312017v1
cs/0402036v1,2004-02-16T21:56:03Z,Towards a Model-Based Framework for Integrating Usability and Software   Engineering Life Cycles,H. Rex Hartson,cs.HC,http://arxiv.org/pdf/cs/0402036v1
cs/0405078v1,2004-05-23T09:53:12Z,Generative Programming of Graphical User Interfaces,Jean Vanderdonckt,cs.HC,http://arxiv.org/pdf/cs/0405078v1
cs/0405108v1,2004-05-28T02:53:46Z,"""User Interfaces"" and the Social Negotiation of Availability",Allison Woodruff,cs.HC,http://arxiv.org/pdf/cs/0405108v1
cs/0405109v1,2004-05-28T02:59:54Z,Conversation Analysis and the User Experience,Paul M. Aoki,cs.HC,http://arxiv.org/pdf/cs/0405109v1
cs/0409041v1,2004-09-23T19:08:17Z,Four Principles Fundamental to Design Practice for Human Centred Systems,Vita Hinze-Hoare,cs.HC,http://arxiv.org/pdf/cs/0409041v1
cs/0505011v1,2005-05-04T16:17:54Z,SWiM: A Simple Window Mover,Ramona Su,cs.HC,http://arxiv.org/pdf/cs/0505011v1
cs/0507019v1,2005-07-06T21:29:09Z,Making Space for Stories: Ambiguity in the Design of Personal   Communication Systems,Allison Woodruff,cs.HC,http://arxiv.org/pdf/cs/0507019v1
cs/0508041v2,2005-08-04T22:39:49Z,OpenVanilla - A Non-Intrusive Plug-In Framework of Text Services,Wen-Lien Hsu,cs.HC,http://arxiv.org/pdf/cs/0508041v2
cs/0508042v2,2005-08-04T22:49:38Z,OpenVanilla - A Non-Intrusive Plug-In Framework of Text Services,Wen-Lien Hsu,cs.HC,http://arxiv.org/pdf/cs/0508042v2
cs/0601021v1,2006-01-07T11:06:23Z,Lighting Control using Pressure-Sensitive Touchpads,Alexander Haubold,cs.HC,http://arxiv.org/pdf/cs/0601021v1
cs/0601025v1,2006-01-09T13:52:32Z,Prop-Based Haptic Interaction with Co-location and Immersion: an   Automotive Application,Sabine Coquillart,cs.HC,http://arxiv.org/pdf/cs/0601025v1
cs/0604103v1,2006-04-25T19:53:19Z,Further Evaluationh of VLEs using HCI and Educational Metrics,Vita Hinze-Hoare,cs.HC,http://arxiv.org/pdf/cs/0604103v1
cs/0606107v1,2006-06-26T15:58:40Z,Human Information Processing with the Personal Memex,Prince Vincent,cs.HC,http://arxiv.org/pdf/cs/0606107v1
cs/0607072v1,2006-07-14T16:00:40Z,Effect of Interface Style in Peer Review Comments for UML Designs,Stephen H. Edwards,cs.HC,http://arxiv.org/pdf/cs/0607072v1
cs/0608083v2,2006-08-21T01:42:52Z,"Where's the ""Party"" in ""Multi-Party""? Analyzing the Structure of   Small-Group Sociable Talk",Weilie Yi,cs.HC,http://arxiv.org/pdf/cs/0608083v2
cs/0611151v2,2006-11-29T16:22:18Z,Collaborative design : managing task interdependencies and multiple   perspectives,Françoise Détienne,cs.HC,http://arxiv.org/pdf/cs/0611151v2
cs/0611152v2,2006-11-29T16:24:20Z,Viewpoints in co-design: a field study in concurrent engineering,Elisabeth Lavigne,cs.HC,http://arxiv.org/pdf/cs/0611152v2
cs/0611153v2,2006-11-29T16:55:30Z,Changing our view on design evaluation meetings methodology: a study of   software technical review meetings,Pierre Robillard,cs.HC,http://arxiv.org/pdf/cs/0611153v2
cs/0611154v2,2006-11-29T16:57:41Z,Assessing the cognitive consequences of the object-oriented approach: a   survey of empirical research on object-oriented design by individuals and   teams,Françoise Détienne,cs.HC,http://arxiv.org/pdf/cs/0611154v2
cs/0611158v2,2006-11-30T13:28:29Z,Articulation entre élaboration de solutions et argumentation   polyphonique,Arnauld Séjourné,cs.HC,http://arxiv.org/pdf/cs/0611158v2
cs/0611159v2,2006-11-30T09:50:30Z,Cognitive Effort in Collective Software Design: Methodological   Perspectives in Cognitive Ergonomics,Willemien Visser,cs.HC,http://arxiv.org/pdf/cs/0611159v2
cs/0612004v2,2006-11-30T22:42:06Z,"Object-Oriented Program Comprehension: Effect of Expertise, Task and   Phase",Susan Wiedenbeck,cs.HC,http://arxiv.org/pdf/cs/0612004v2
cs/0612005v2,2006-11-30T22:43:22Z,Quantitative Measurements of the Influence of Participant Roles during   Peer Review Meetings,Willemien Visser,cs.HC,http://arxiv.org/pdf/cs/0612005v2
cs/0612006v1,2006-11-30T22:49:11Z,Evocation and elaboration of solutions: Different types of   problem-solving actions. An empirical study on the design of an aerospace   artifact,Willemien Visser,cs.HC,http://arxiv.org/pdf/cs/0612006v1
cs/0612008v2,2006-12-01T11:42:02Z,Design Strategies and Knowledge in Object-Oriented Programming: Effects   of Experience,Françoise Détienne,cs.HC,http://arxiv.org/pdf/cs/0612008v2
cs/0612009v1,2006-12-01T11:42:44Z,Users' participation to the design process in an Open Source Software   online community,Jean-Marie Burkhardt,cs.HC,http://arxiv.org/pdf/cs/0612009v1
cs/0612010v2,2006-12-01T11:43:08Z,Articulation entre composantes verbale et graphico-gestuelle de   l'interaction dans des réunions de conception architecturale,Françoise Détienne,cs.HC,http://arxiv.org/pdf/cs/0612010v2
cs/0612016v2,2006-12-04T13:48:22Z,Memory of past designs: distinctive roles in individual and collective   design,Françoise Détienne,cs.HC,http://arxiv.org/pdf/cs/0612016v2
cs/0612017v2,2006-12-04T13:49:09Z,Confrontation of viewpoints in a concurrent engineering process,Elisabeth Lavigne,cs.HC,http://arxiv.org/pdf/cs/0612017v2
cs/0612018v2,2006-12-04T13:50:07Z,Mental Representations Constructed by Experts and Novices in   Object-Oriented Program Comprehension,Susan Wiedenbeck,cs.HC,http://arxiv.org/pdf/cs/0612018v2
cs/0612021v2,2006-12-04T16:27:32Z,Multimodality and parallelism in design interaction: co-designers'   alignment and coalitions,Willemien Visser,cs.HC,http://arxiv.org/pdf/cs/0612021v2
cs/0612022v1,2006-12-04T16:28:44Z,Both Generic Design and Different Forms of Designing,Willemien Visser,cs.HC,http://arxiv.org/pdf/cs/0612022v1
cs/0612023v2,2006-12-04T18:45:55Z,Reusing processes and documenting processes: toward an integrated   framework,Catherine Deleuze-Dordron,cs.HC,http://arxiv.org/pdf/cs/0612023v2
cs/0612081v1,2006-12-18T07:53:34Z,Personal Information Ecosystems and Implications for Design,Steve Harrison,cs.HC,http://arxiv.org/pdf/cs/0612081v1
cs/0612090v1,2006-12-18T22:24:02Z,A Review of Papers that have a bearing on an Analysis of User   Interactions in A Collaborative On-line Laboratory,Vita Hinze-Hoare,cs.HC,http://arxiv.org/pdf/cs/0612090v1
cs/0701199v2,2007-01-31T16:36:43Z,A Virtual Logo Keyboard for People with Motor Disabilities,Fernando G. Lobo,cs.HC,http://arxiv.org/pdf/cs/0701199v2
cs/0702001v1,2007-02-01T09:01:55Z,Measuring Cognitive Activities in Software Engineering,Willemien Visser,cs.HC,http://arxiv.org/pdf/cs/0702001v1
cs/0702002v1,2007-02-01T09:02:17Z,The Effect of Object-Oriented Programming Expertise in Several   Dimensions of Comprehension Strategies,Susan Wiedenbeck,cs.HC,http://arxiv.org/pdf/cs/0702002v1
cs/0702003v1,2007-02-01T09:02:38Z,Expert Programming Knowledge: a Schema-Based Approach,Françoise Détienne,cs.HC,http://arxiv.org/pdf/cs/0702003v1
cs/0702004v1,2007-02-01T09:03:19Z,What model(s) for program understanding?,Françoise Détienne,cs.HC,http://arxiv.org/pdf/cs/0702004v1
cs/0702005v1,2007-02-01T09:03:59Z,An empirical study of software reuse by experts in object-oriented   design,Françoise Détienne,cs.HC,http://arxiv.org/pdf/cs/0702005v1
cs/0702006v1,2007-02-01T09:05:13Z,Negotiation in collaborative assessment of design solutions: an   empirical study on a Concurrent Engineering process,Elisabeth Lavigne,cs.HC,http://arxiv.org/pdf/cs/0702006v1
cs/0703008v1,2007-03-02T12:50:12Z,Strategies in object-oriented design,Françoise Détienne,cs.HC,http://arxiv.org/pdf/cs/0703008v1
cs/0703009v1,2007-03-02T13:51:29Z,A Methodological Framework for Socio-Cognitive Analyses of Collaborative   Design of Open Source Software,Flore Barcellini,cs.HC,http://arxiv.org/pdf/cs/0703009v1
cs/0703044v1,2007-03-09T16:55:23Z,"BrlAPI: Simple, Portable, Concurrent, Application-level Control of   Braille Terminals",Sebastien Hinderer,cs.HC,http://arxiv.org/pdf/cs/0703044v1
cs/0703070v3,2007-03-15T00:00:06Z,Flexible Audio Streams,Paul Fodor,cs.HC,http://arxiv.org/pdf/cs/0703070v3
0704.2542v1,2007-04-19T14:27:25Z,Narratives within immersive technologies,Joan Llobera,cs.HC,http://arxiv.org/pdf/0704.2542v1
0704.3643v1,2007-04-27T00:42:22Z,"Sabbath Day Home Automation: ""It's Like Mixing Technology and Religion""",Brooke Foucault,cs.HC,http://arxiv.org/pdf/0704.3643v1
0705.0599v3,2007-05-04T11:50:07Z,NodeTrix: Hybrid Representation for Analyzing Social Networks,Michael Mcguffin,cs.HC,http://arxiv.org/pdf/0705.0599v3
0706.0507v1,2007-06-04T19:48:07Z,A collaborative framework to exchange and share product information   within a supply chain context,Nikolaos Sapidis,cs.HC,http://arxiv.org/pdf/0706.0507v1
0706.1162v1,2007-06-08T11:29:24Z,The multiple viewpoints as approach to information retrieval within   collaborative development context,Nikolaos Sapidis,cs.HC,http://arxiv.org/pdf/0706.1162v1
0706.1780v1,2007-06-12T20:06:38Z,Le travail collaboratif dans le cadre d'un projet architectural,Marie-France Ango-Obiang,cs.HC,http://arxiv.org/pdf/0706.1780v1
0706.3165v1,2007-06-21T14:40:25Z,A solution for actors' viewpoints representation with collaborative   product development,Nikolaos Sapidis,cs.HC,http://arxiv.org/pdf/0706.3165v1
0707.1480v1,2007-07-10T16:01:30Z,IRVO: an Interaction Model for designing Collaborative Mixed Reality   systems,Bertrand T. David,cs.HC,http://arxiv.org/pdf/0707.1480v1
0707.3638v1,2007-07-24T20:19:47Z,The Review and Analysis of Human Computer Interaction (HCI) Principles,V. Hinze-Hoare,cs.HC,http://arxiv.org/pdf/0707.3638v1
0708.0877v1,2007-08-07T19:53:24Z,A Portal Analysis for the Design of a Collaborative Research Environment   for Students and Supervisors (CRESS) within the CSCR Domain,V. Hinze-Hoare,cs.HC,http://arxiv.org/pdf/0708.0877v1
0708.1624v1,2007-08-12T19:58:37Z,Designing a Collaborative Research Environment for Students and their   Supervisors (CRESS),V. Hinze-Hoare,cs.HC,http://arxiv.org/pdf/0708.1624v1
0708.1725v2,2007-08-13T15:00:37Z,"Design: One, but in different forms",Willemien Visser,cs.HC,http://arxiv.org/pdf/0708.1725v2
0708.3341v1,2007-08-24T13:33:38Z,Browsing through 3D representations of unstructured picture collections:   an empirical study,Noëlle Carbonell,cs.HC,http://arxiv.org/pdf/0708.3341v1
0708.3505v1,2007-08-26T18:53:41Z,Gaze as a Supplementary Modality for Interacting with Ambient   Intelligence Environments,Noëlle Carbonell,cs.HC,http://arxiv.org/pdf/0708.3505v1
0708.3575v1,2007-08-27T11:53:35Z,How really effective are Multimodal Hints in enhancing Visual Target   Spotting? Some evidence from a usability study,Noëlle Carbonell,cs.HC,http://arxiv.org/pdf/0708.3575v1
0708.3580v1,2007-08-27T12:11:56Z,Ambient Multimodality: an Asset for Developing Universal Access to the   Information Society,Noëlle Carbonell,cs.HC,http://arxiv.org/pdf/0708.3580v1
0708.3740v1,2007-08-28T09:56:05Z,Plate-forme Magicien d'Oz pour l'étude de l'apport des ACAs à   l'interaction,Noëlle Carbonell,cs.HC,http://arxiv.org/pdf/0708.3740v1
0708.3742v1,2007-08-28T09:57:43Z,Interfaces adaptatives Adaptation dynamique à l'utilisateur courant,Noëlle Carbonell,cs.HC,http://arxiv.org/pdf/0708.3742v1
0708.4082v1,2007-08-30T06:39:15Z,Aides en ligne à l'utilisation de logiciels grand public : problèmes   spécifiques de conception et solutions potentielles,Noëlle Carbonell,cs.HC,http://arxiv.org/pdf/0708.4082v1
0709.0370v1,2007-09-04T09:20:03Z,An Integrated Simulation System for Human Factors Study,Damien Chablat,cs.HC,http://arxiv.org/pdf/0709.0370v1
0709.0426v1,2007-09-04T13:23:40Z,Do oral messages help visual search?,Suzanne Kieffer,cs.HC,http://arxiv.org/pdf/0709.0426v1
0709.0428v1,2007-09-04T13:27:33Z,Oral messages improve visual search,Noëlle Carbonell,cs.HC,http://arxiv.org/pdf/0709.0428v1
0710.0842v1,2007-10-03T17:23:59Z,Systèmes interactifs sensibles aux émotions : architecture   logicielle,Alexis Clay,cs.HC,http://arxiv.org/pdf/0710.0842v1
0710.0847v1,2007-10-03T17:36:07Z,Emotion capture based on body postures and movements,Laurence Nigay,cs.HC,http://arxiv.org/pdf/0710.0847v1
0710.0859v1,2007-10-03T18:30:07Z,Assistance orale à la recherche visuelle - étude expérimentale de   l'apport d'indications spatiales à la détection de cibles,Noëlle Carbonell,cs.HC,http://arxiv.org/pdf/0710.0859v1
0710.4999v2,2007-10-26T06:32:22Z,L'analyse de l'expertise du point de vue de l'ergonomie cognitive,Willemien Visser,cs.HC,http://arxiv.org/pdf/0710.4999v2
0711.1226v1,2007-11-08T09:29:57Z,Dynamic aspects of individual design activities. A cognitive ergonomics   viewpoint,Willemien Visser,cs.HC,http://arxiv.org/pdf/0711.1226v1
0711.1227v1,2007-11-08T09:33:19Z,Designing as Construction of Representations: A Dynamic Viewpoint in   Cognitive Design Research,Willemien Visser,cs.HC,http://arxiv.org/pdf/0711.1227v1
0711.2239v1,2007-11-14T16:18:42Z,Mise en place de scénarios pour la conception d'outils en Chirurgie   Minimalement Invasive,Brigitte Meillon,cs.HC,http://arxiv.org/pdf/0711.2239v1
0711.2486v1,2007-11-15T19:22:16Z,An annotation based approach to support design communication,Jean-François Boujut,cs.HC,http://arxiv.org/pdf/0711.2486v1
0711.2760v1,2007-11-17T20:08:41Z,Computer Supported Collaborative Research,Vita Hinze-Hoare,cs.HC,http://arxiv.org/pdf/0711.2760v1
0711.2811v1,2007-11-18T19:10:18Z,Une approche par les modèles pour le suivi de l'activité de   construction d'un bâtiment. Bat'iViews : une interface multi-vues   orientée gestion de chantier,Sylvain Kubicki,cs.HC,http://arxiv.org/pdf/0711.2811v1
0711.2971v1,2007-11-19T16:36:02Z,IT services design to support coordination practices in the   Luxembourguish AEC sector,Gilles Halin,cs.HC,http://arxiv.org/pdf/0711.2971v1
0712.1759v1,2007-12-11T16:47:54Z,A Web-based System for Observing and Analyzing Computer Mediated   Communications,Patrick Prévôt,cs.HC,http://arxiv.org/pdf/0712.1759v1
0712.1768v1,2007-12-11T16:59:19Z,"Conceptions et usages des plates-formes de formation, Revue Sciences et   Technologies de l'Information et de la Communication pour l'Éducation et la   Formation",Alain Derycke,cs.HC,http://arxiv.org/pdf/0712.1768v1
0712.1800v1,2007-12-11T19:30:46Z,Conception d'outils de communication spécifiques au contexte   éducatif,Cécile Bothorel,cs.HC,http://arxiv.org/pdf/0712.1800v1
0712.2168v1,2007-12-13T15:14:01Z,Study of conditions of use of E-services accessible to visually disabled   persons,Françoise Sandoz-Guermond,cs.HC,http://arxiv.org/pdf/0712.2168v1
0712.2183v1,2007-12-13T16:43:56Z,Apports des démarches d'inspection et des tests d'usage dans   l'évaluation de l'accessibilité de E-services,Françoise Sandoz-Guermond,cs.HC,http://arxiv.org/pdf/0712.2183v1
0712.3215v1,2007-12-19T15:54:07Z,L'accessibilité des E-services aux personnes non-voyantes :   difficultés d'usage et recommandations,Marc-Eric Bobiller-Chaumon,cs.HC,http://arxiv.org/pdf/0712.3215v1
0712.3433v1,2007-12-19T23:31:55Z,AccelKey Selection Method for Mobile Devices,Vadim Zaliva,cs.HC,http://arxiv.org/pdf/0712.3433v1
0801.1033v1,2008-01-07T16:05:46Z,"The What, Who, Where, When, Why and How of Context-Awareness",Chris Baber,cs.HC,http://arxiv.org/pdf/0801.1033v1
0801.1925v1,2008-01-12T23:39:30Z,A Framework for Designing Teleconsultation Systems in Africa,Paul M. Aoki,cs.HC,http://arxiv.org/pdf/0801.1925v1
0801.1927v1,2008-01-12T23:43:18Z,Asynchronous Remote Medical Consultation for Ghana,Paul M. Aoki,cs.HC,http://arxiv.org/pdf/0801.1927v1
0801.3114v1,2008-01-21T00:33:15Z,Thinking is Bad: Implications of Human Error Research for Spreadsheet   Research and Practice,Raymond R. Panko,cs.HC,http://arxiv.org/pdf/0801.3114v1
0801.4423v1,2008-01-29T04:42:26Z,"It's Not What You Have, But How You Use It: Compromises in Mobile Device   Use",Manuel Perez-Quinones,cs.HC,http://arxiv.org/pdf/0801.4423v1
0802.3477v1,2008-02-24T01:49:31Z,Concerning the Feasibility of Example-driven Modelling Techniques,Z. Lawson,cs.HC,http://arxiv.org/pdf/0802.3477v1
0802.3480v1,2008-02-24T02:10:03Z,Why Task-Based Training is Superior to Traditional Training Methods,Kath McGuire,cs.HC,http://arxiv.org/pdf/0802.3480v1
0802.3481v1,2008-02-24T02:15:49Z,Establishing A Minimum Generic Skill Set For Risk Management Teaching In   A Spreadsheet Training Course,David Chadwick,cs.HC,http://arxiv.org/pdf/0802.3481v1
0802.3483v1,2008-02-24T02:21:35Z,Voice-controlled Debugging of Spreadsheets,Kevin Mc Daid,cs.HC,http://arxiv.org/pdf/0802.3483v1
0802.3919v1,2008-02-26T21:58:26Z,A Paradigm for Spreadsheet Engineering Methodologies,Ozgur Ozluk,cs.HC,http://arxiv.org/pdf/0802.3919v1
0802.3924v1,2008-02-26T22:11:24Z,A Toolkit for Scalable Spreadsheet Visualization,Markus Clermont,cs.HC,http://arxiv.org/pdf/0802.3924v1
0802.3939v1,2008-02-27T00:14:34Z,Using Layout Information for Spreadsheet Visualization,Sabine Hipfl,cs.HC,http://arxiv.org/pdf/0802.3939v1
0803.0165v1,2008-03-03T01:34:30Z,Documenting Spreadsheets,Raymond Payette,cs.HC,http://arxiv.org/pdf/0803.0165v1
0803.0166v1,2008-03-03T01:40:31Z,Spreadsheet Validation and Analysis through Content Visualization,Michael Peters,cs.HC,http://arxiv.org/pdf/0803.0166v1
0803.0167v1,2008-03-03T01:49:03Z,Does an awareness of differing types of spreadsheet errors aid end-users   in identifying spreadsheets errors?,David Chadwick,cs.HC,http://arxiv.org/pdf/0803.0167v1
0803.0168v1,2008-03-03T01:55:40Z,Comparison of Characteristics and Practices amongst Spreadsheet Users   with Different Levels of Experience,Lynn Foster-Johnson,cs.HC,http://arxiv.org/pdf/0803.0168v1
0803.0169v1,2008-03-03T02:00:53Z,An Investigation of the Incidence and Effect of Spreadsheet Errors   Caused by the Hard Coding of Input Data Values into Formulas,Paul J. Blayney,cs.HC,http://arxiv.org/pdf/0803.0169v1
0803.0515v1,2008-03-04T18:46:49Z,Intuitive Source Code Visualization Tools for Improving Student   Comprehension: BRICS,Yvonne Coady,cs.HC,http://arxiv.org/pdf/0803.0515v1
0803.1104v1,2008-03-07T14:50:21Z,Optimizing Web Sites for Customer Retention,Michael Hahsler,cs.HC,http://arxiv.org/pdf/0803.1104v1
0803.1866v1,2008-03-12T22:30:10Z,Risk Management for Complex Calculations: EuSpRIG Best Practices in   Hybrid Applications,Ben VanVliet,cs.HC,http://arxiv.org/pdf/0803.1866v1
0803.1875v1,2008-03-13T00:15:40Z,Breaking Out of the Cell: On The Benefits of a New Spreadsheet   User-Interaction Paradigm,Ziv Hellman,cs.HC,http://arxiv.org/pdf/0803.1875v1
0803.2527v1,2008-03-17T20:46:12Z,Controlling the Information Flow in Spreadsheets,Sangeeta Patni,cs.HC,http://arxiv.org/pdf/0803.2527v1
0803.3394v1,2008-03-24T12:01:16Z,Facing the Facts,Patrick O'Beirne,cs.HC,http://arxiv.org/pdf/0803.3394v1
0804.0556v1,2008-04-03T13:40:02Z,RubberEdge: Reducing Clutching by Combining Position and Rate Control   with Elastic Feedback,Christophe Chaillou,cs.HC,http://arxiv.org/pdf/0804.0556v1
0804.0937v1,2008-04-06T23:20:15Z,Issues in Strategic Decision Modelling,Paula Jennings,cs.HC,http://arxiv.org/pdf/0804.0937v1
0805.1741v1,2008-05-12T20:40:27Z,A Spreadsheet Auditing Tool Evaluated in an Industrial Context,Roland T. Mittermeir,cs.HC,http://arxiv.org/pdf/0805.1741v1
0805.2189v1,2008-05-15T00:27:15Z,Visual Checking of Spreadsheets,Hock Chuan Chan,cs.HC,http://arxiv.org/pdf/0805.2189v1
0806.0189v1,2008-06-01T23:51:12Z,Investigating the use of Software Agents to Reduce The Risk of   Undetected Errors in Strategic Spreadsheet Applications,Karen Fernandez,cs.HC,http://arxiv.org/pdf/0806.0189v1
0807.2628v1,2008-07-16T18:31:14Z,Un cadre de conception pour réunir les modèles d'interaction et   l'ingénierie des interfaces,David Faure,cs.HC,http://arxiv.org/pdf/0807.2628v1
0807.2836v1,2008-07-17T17:22:55Z,Ordinateur porté support de réalité augmentée pour des   activités de maintenance et de dépannage,Guillaume Masserey,cs.HC,http://arxiv.org/pdf/0807.2836v1
0807.2993v1,2008-07-18T15:45:47Z,Establishing and Measuring Standard Spreadsheet Practices for End-Users,Garry Cleere,cs.HC,http://arxiv.org/pdf/0807.2993v1
0807.3184v1,2008-07-20T20:43:05Z,Research Strategy and Scoping Survey on Spreadsheet Practices,Ozgur Ozluk,cs.HC,http://arxiv.org/pdf/0807.3184v1
0807.3186v1,2008-07-20T20:58:37Z,New Guidelines For Spreadsheets,John F. Raffensperger,cs.HC,http://arxiv.org/pdf/0807.3186v1
0809.0461v1,2008-09-02T17:25:25Z,The Semiotic Machine,Eric Engle,cs.HC,http://arxiv.org/pdf/0809.0461v1
0809.1019v1,2008-09-05T12:59:06Z,Moving and resizing of the screen objects,Sergey Andreyev,cs.HC,http://arxiv.org/pdf/0809.1019v1
0809.3571v1,2008-09-21T11:06:23Z,Evaluation of an Intelligent Assistive Technology for Voice Navigation   of Spreadsheets,Brian Bishop,cs.HC,http://arxiv.org/pdf/0809.3571v1
0809.3595v1,2008-09-21T17:45:08Z,Controlling End User Computing Applications - a case study,John Hamill,cs.HC,http://arxiv.org/pdf/0809.3595v1
0809.3597v1,2008-09-21T18:05:42Z,Spreadsheets: Aiming the Accountant's Hammer to Hit the Nail on the Head,Patty Brown,cs.HC,http://arxiv.org/pdf/0809.3597v1
0809.3612v1,2008-09-21T20:16:14Z,Overview and main results of the DidaTab project,Francoise Tort,cs.HC,http://arxiv.org/pdf/0809.3612v1
0810.4431v1,2008-10-24T11:50:03Z,An Eye Tracking Study into the Effects of Graph Layout,Weidong Huang,cs.HC,http://arxiv.org/pdf/0810.4431v1
0811.1974v1,2008-11-12T20:31:34Z,Magic Fairy Tales as Source for Interface Metaphors,Vladimir L. Averbukh,cs.HC,http://arxiv.org/pdf/0811.1974v1
0902.1104v3,2009-02-06T14:55:20Z,"How happy is your web browsing? A model to quantify satisfaction of an   Internet user, searching for desired information",Aniket Magarkar,cs.HC,http://arxiv.org/pdf/0902.1104v3
0903.4261v1,2009-03-25T08:43:19Z,On-Line Tests,Florentina Anica Pintea,cs.HC,http://arxiv.org/pdf/0903.4261v1
0904.0719v1,2009-04-04T15:08:43Z,"Moveable objects and applications, based on them",Sergey Andreyev,cs.HC,http://arxiv.org/pdf/0904.0719v1
0905.0200v1,2009-05-02T11:42:50Z,A Vehicle for Research: Using Street Sweepers to Explore the Landscape   of Environmental Community Action,Allison Woodruff,cs.HC,http://arxiv.org/pdf/0905.0200v1
0905.0203v1,2009-05-02T11:54:52Z,ICTD for Healthcare in Ghana: Two Parallel Case Studies,Paul M. Aoki,cs.HC,http://arxiv.org/pdf/0905.0203v1
0905.0484v1,2009-05-04T20:32:22Z,Extended Bulgarian keyboard layouts,Anton Zinoviev,cs.HC,http://arxiv.org/pdf/0905.0484v1
0905.3070v1,2009-05-19T11:46:13Z,Narrative Bridging - a specification of a modelling method for game   design,Katarina Borg Gyllenback,cs.HC,http://arxiv.org/pdf/0905.3070v1
0905.4864v1,2009-05-29T13:49:44Z,Computer Based Interpretation of the Students' Evaluation of the   Teaching Staff,Catalin Tuican,cs.HC,http://arxiv.org/pdf/0905.4864v1
0906.2307v1,2009-06-12T13:47:46Z,Shopping Uncertainties in a Mobile and Social Context,Nuria Oliver,cs.HC,http://arxiv.org/pdf/0906.2307v1
0906.4125v1,2009-06-22T20:31:45Z,A Refined Experience Sampling Method to Capture Mobile User Experience,Nuria Oliver,cs.HC,http://arxiv.org/pdf/0906.4125v1
0907.1251v1,2009-07-07T16:15:21Z,How to Evaluate Controlled Natural Languages,Tobias Kuhn,cs.HC,http://arxiv.org/pdf/0907.1251v1
0907.5500v1,2009-07-31T10:06:29Z,Decoding Finger Flexion using amplitude modulation from band-specific   ECoG,Laurent Bougrain,cs.HC,http://arxiv.org/pdf/0907.5500v1
0908.1191v1,2009-08-08T21:13:27Z,Embedded Spreadsheet Modelling,Angela Collins,cs.HC,http://arxiv.org/pdf/0908.1191v1
